<?xml version="1.0" encoding="UTF-8"?>

<BTK_orarend xmlns:xsi="http://www.w3.org/2001/XMLSchema-instance" xsi:noNamespaceSchemaLocation="XMLSchemaCUNPO1.xsd">
    <ora id="1" tipus="Elmélet">
        <targy>Valószínűségszámítás és statisztika</targy>
        <idopont>
            <nap>hétfő</nap>
            <tol>10</tol>
            <ig>14</ig>
        </idopont>
        <helyszin>Teológia Szemere utca 1/A</helyszin>
        <oktato>Alföldi Attila</oktato>
        <szak>Programtervező informatikus</szak>
    </ora>
    <ora id="2" tipus="Gyakorlat">
        <targy>Webkönyvtárak</targy>
        <idopont>
            <nap>kedd</nap>
            <tol>12</tol>
            <ig>14</ig>
        </idopont>
        <helyszin>Teológia Szemere utca 1/A</helyszin>
        <oktato>Dr. Bednarik László</oktato>
        <szak>Programtervező informatikus</szak>
    </ora>
    <ora id="3" tipus="Gyakorlat">
        <targy>Webkönyvtárak</targy>
        <idopont>
            <nap>kedd</nap>
            <tol>16</tol>
            <ig>18</ig>
        </idopont>
        <helyszin>Teológia Szemere utca 1/A</helyszin>
        <oktato>Dr. Bednarik László</oktato>
        <szak>Programtervező informatikus</szak>
    </ora>
    <ora id="4" tipus="Elmélet">
        <targy>Komputergrafika és képfeldolgozás</targy>
        <idopont>
            <nap>csütörtök</nap>
            <tol>12</tol>
            <ig>14</ig>
        </idopont>
        <helyszin>Teológia Szemere utca 1/A</helyszin>
        <oktato>Dr. Bednarik László</oktato>
        <szak>Programtervező informatikus</szak>
    </ora>
    <ora id="5" tipus="Elmélet">
        <targy>Komputergrafika és képfeldolgozás</targy>
        <idopont>
            <nap>csütörtök</nap>
            <tol>16</tol>
            <ig>18</ig>
        </idopont>
        <helyszin>Teológia Szemere utca 1/A</helyszin>
        <oktato>Dr. Bednarik László</oktato>
        <szak>Programtervező informatikus</szak>
    </ora>
    <ora id="6" tipus="Elmélet">
        <targy>Kalkulus</targy>
        <idopont>
            <nap>péntek</nap>
            <tol>13</tol>
            <ig>18</ig>
        </idopont>
        <helyszin>-</helyszin>
        <oktato>Wiersumné Dr. Gyöngyösi Erika</oktato>
        <szak>Programtervező informatikus</szak>
    </ora>
    <ora id="7" tipus="Elmélet">
        <targy>Operációs rendszerek</targy>
        <idopont>
            <nap>szombat</nap>
            <tol>9</tol>
            <ig>13</ig>
        </idopont>
        <helyszin>-</helyszin>
        <oktato>Janics Tamás</oktato>
        <szak>Programtervező informatikus</szak>
    </ora>
</BTK_orarend>